{
   "$schema":"http://json-schema.org/draft-06/schema#",
   "$id":"https://standards-ontotest.oftrust.net/v2/Schema/DataProductParameters/Document",
   "type":"object",
   "required":[
      
   ],
   "properties":{
      "@context":{
         "$id":"#/properties/@context",
         "type":"string",
         "const":"https://standards-ontotest.oftrust.net/v2/Context/DataProductParameters/Document/",
         "title":"JSON-LD context url",
         "description":"JSON-LD context url with terms required to understand data product content."
      },
      "productCode":{
         "$id":"#/properties/productCode",
         "type":"string",
         "title":"Productcode",
         "description":"Name of the product."
      },
      "timestamp":{
         "$id":"#/properties/timestamp",
         "type":"string",
         "title":"Timestamp of the request",
         "description":"Timestamp of the request."
      },
      "parameters":{
         "$id":"#/properties/parameters",
         "type":"object",
         "title":"Actual data product parameters",
         "description":"An explanation about the purpose of this instance.",
         "required":[
            
         ],
         "properties":{
            "targetObject":{
               "$id":"#/properties/parameters/properties/targetObject",
               "type":"string",
               "title":"Target object",
               "description":"Target object."
            },
            "period":{
               "$id":"#/properties/parameters/properties/period",
               "type":"string",
               "title":"Period",
               "description":"Period"
            },
            "limit":{
               "$id":"#/properties/parameters/properties/limit",
               "type":"integer",
               "title":"Limit",
               "description":"Limit."
            },
            "offset":{
               "$id":"#/properties/parameters/properties/offset",
               "type":"integer",
               "title":"Offset",
               "description":"Number of signing processes to offset. Default is 0."
            }
         }
      }
   }
}