{
   "@context":"https://standards-ontotest.oftrust.net/v2/Context/DataProductParameters/Document/",
   "productCode":"multidata-product-1",
   "timestamp":"2019-10-19T13:20:09+00:00",
   "parameters":{
      "targetObject":"object id",
      "period":"2015-12-31T23:00Z/2016-12-31T23:00Z",
      "limit":20,
      "offset":0
   }
}